,Id/Reply-Id,User,Comment,Date,Likes,Reply To CommentId,Link,Filename
9,10,multitude.of.drops,"Liebes Team hinter Sophie, mich würde Mal interessieren ob es einen bestimmten Grund gibt, weshalb ihr auf manchen Fotos das SWR Logo macht und auf manchen nicht 🤔 Meine Vermutung war, dass es auf den Fotos ist, die Nazipropaganda zeigen, um sie deutlich als Teil eines solchen Projekts zu kennzeichnen. Aber auf dem Plakat zum Verdunkeln ist zb kein Logo drauf... Bin einfach neugierig.😊",2022-01-07T12:58:19.000Z,4 likes,-,https://www.instagram.com/p/CYbSIO_MsEj/,comments-295592494998822966.csv
2,3,eleirbag_essov,"Ihr seid auf himmlische Weise zusammen geschmiedet, ihr vertraut einander in großer Freiheit, ihr geht nun gemeinsam durch dick und dünn, durch hell und dunkel ; diese Verbindung gibt euch Kraft, und ihr dürft spüren : Gemeinsam können wir mehr als allein!",2021-06-13T23:17:11.000Z,0,-,https://www.instagram.com/p/CQBPUn-rYcr/,comments5887725245100549857.csv
9,10,eleirbag_essov,"Ihr seid auf himmlische Weise zusammen geschmiedet, ihr vertraut einander in großer Freiheit, ihr geht nun gemeinsam durch dick und dünn, durch hell und dunkel ; diese Verbindung gibt euch Kraft, und ihr dürft spüren : Gemeinsam können wir mehr als allein!",2021-06-13T06:25:02.000Z,1 like,-,https://www.instagram.com/p/CQBPUn-rYcr/,comments5887725245100549857.csv
15,16,liebeleinenladenlauenau,....unter der Laterne ist's am Dunkelsten..... 😉👍,2022-01-14T12:40:40.000Z,10 likes,-,https://www.instagram.com/p/CYtNWBZlNB6/,comments6007312751865124505.csv
15,16,lindwurmallee,Ich erinnere mich dunkel daran das Quartett und Brettspiel im Geschichtsunterricht gehabt zu haben.,2021-12-28T12:37:20.000Z,2 likes,-,https://www.instagram.com/p/CYBburusFKK/,comments7898478158277816780.csv
34,30,wonghorst,"„Starker Geist, weiches Herz - das will ich immer haben“ mit Blick auf die Geschichte und das Ende von Sophie ist dies sehr berührend. Für mich eine Lichtgestalt in der Dunkelheit.",2021-05-22T17:42:40.000Z,0,-,https://www.instagram.com/p/CPLRi48nrz7/,comments8355353662295954093.csv
12,10,elmalu95,"Ich kann mich noch gut an eine Geschichte meiner Oma erinnern. Sie erzählte mir mal, das sie und ihre Familie abends ängstlich im Haus saßen und einen dunkeln Mann auf das Haus zukommen sahen. Alle hatten furchtbare Panik vor diesem Mann bis schließlich eine von ihnen erkannte, dass es ihr Vater war, der gerade von der Front schwer verwundet mit einer schusswunde in der linken Brust, zurück kam. Sie versorgten ihn so gut es eben ging. Leider hat er es dennoch nicht geschafft. Noch heute bekomme ich eine Gänsehaut wenn ich an diese Geschichte denke. Der Blick meiner Oma, wie er in die Vergangenheit verschwand als sie das so erzählte. Ihre Stimme, der Ton. Sie war ganz und gar in Erinnerungen versunken. Und auch ich konnte keinen Ton rausbringen. Ich starrte sie nur an, hörte zu und war und bin bis heute geschockt über diese Erinnerungen und die Stärke, die sie einfach auch als Person ausmacht.",2021-09-08T13:02:31.000Z,8 likes,-,https://www.instagram.com/p/CTjMDCrjFP6/,comments4768888214613560086.csv
22,12,gabielpunkt,"Wir, die wir glücklicherweise keinen Krieg erleben mussten, können uns nicht ansatzweise vorstellen, wie es damals gewesen sein muss. Ständig um sein Leben fürchten zu müssen - schrecklich! Meine Mutter hat erzählt, dass es ihr als Kind nach Einschlag einer Bombe in ihrem Garten wortwörtlich die Sprache verschlagen hat. Sie konnte lange Zeit nicht mehr flüssig sprechen. Die notwendigen Verdunkelungen sitzen ihr noch so in den Knochen, dass sie heute sehr wenig sparsam mit Strom umgeht. In allen Räumen Festbeleuchtung. Sie hat sich geschworen, nie mehr im Dunkeln zu sitzen. Mir ist es rätselhaft, wie diese Generation ihre Traumata überwinden konnte. Psychologischen Beistand hatten sie ja damals nicht",2021-09-08T10:24:41.000Z,26 likes,-,https://www.instagram.com/p/CTjMDCrjFP6/,comments4768888214613560086.csv
28,29,changed.by.popular.demand,"„Wir feiern morgens um 7 Uhr Gemeinschaftsmesse. Es sind im ganzen 12 Mann. Ein kurzer Spaziergang zur Saar. Vater hat eingeladen, wir sitzen mit Sechsen im Lokal. Dann bin ich für die Familie da, wir sind seit langem zusammen, es geht familiär zu, wie wir es von früher gewohnt sind. Bei Dunkelheit ein kurzer Spaziergang mit Vater. Am Abend ist wieder die Familie zusammen.“ Willi Graf: Briefe und Aufzeichnungen, S. 91",2021-12-25T11:41:37.000Z,4 likes,-,https://www.instagram.com/p/CX5mhF5MoAW/,comments1324460612858698161.csv
18,19,stefanesser8315,"""Die Dunkelheit ist großzügig und geduldig und gewinnt Immer, aber im Herzen ihrer Stärke liegt Schwäche: Eine einzelne Kerze genügt, um sie zurückzudrängen. Liebe ist mehr als eine Kerze. Liebe kann Sterne entzünden."" ❤️🕯️",2021-08-01T18:06:25.000Z,8 likes,-,https://www.instagram.com/p/CSCaMn2j6Hg/,comments1063667496254767808.csv
23,22,atelier.rotkehlchen,"Ich bin heute bei Dunkelheit durch die Hauptstraße unserer Altstadt gefahren. An jedem Stolperstein brannte eine Kerze. Es waren viele Kerzen, für so eine kleine Stadt.",2021-11-10T03:25:21.000Z,1 like,-,https://www.instagram.com/p/CWEK2fXMuwx/,comments850110884387814236.csv
59,48,sommerschaf,"Einer der dunkelsten Momente in unserer Geschichte und es wird noch Schlimmer. Was würden wir heute machen, wenn Synagogen brennen oder Moscheen???",2021-11-09T19:54:48.000Z,1 like,-,https://www.instagram.com/p/CWEK2fXMuwx/,comments850110884387814236.csv
58,18-2,katharina.helling,"Wg der Gefahr von Luftangriffen musste man bei Einbruch der Dunkelheit ohnehin „verdunkeln“ - das galt grds, konnte also auch in „normalen“ Wohnungen Probleme nach sich ziehen.",2021-11-16T13:05:42.000Z,9 likes,18,https://www.instagram.com/p/CWVgNyuMRr0/,comments8903630083275150296.csv
118,107,xorron1975,Tiefer Respekt und Hochachtung vor diesem Mut in den dunkelsten Stunden deutschlands sich gegen das Terrorregieme aufzulehen. Niemals vergessen dein Mut ❤️❤️❤️.,2021-05-10T07:40:09.000Z,1 like,-,https://www.instagram.com/p/COqYF8OKIYE/,comments-4907282836930085199.csv
9,9,didi_simone,"Ich denke daran was im schlimmsten Fall passieren kann und mache damit meinen Frieden.Kurz stockt mir dann manchmal der Atem- aber das Bewusstsein, dass die Welt sich weiterdreht und sie mich noch nicht einmal dazu braucht und die Hoffnung ,dass in den dunkelsten Stunden jemand mit einer Fackel kommt um weiterzuhelfen, trägt mich.Das gilt für das Leben und darüber hinaus -in meinem Weltbild auf jeden Fall 😉",2021-07-18T11:43:39.000Z,1 like,-,https://www.instagram.com/p/CRcOWPMsPD3/,comments2421875500100512488.csv
54,46,wiebkewiedeck,"Ich hatte einmal einen Traum.
Es war dunkel, mir ging es nicht gut. Seit Tagen beschäftigten mich schwierige Themen wie Krankheit und Loslassen.
Ich stand auf einer grünen Wiese und spürte, dass gleich etwas Wichtiges passieren wird. Und da - ein riesiger Drache kam aus dem Dunkeln auf die Lichtung. Er hat große, grüne Schuppen und furchterregende Augen. Er baute sich vor mir auf und spie Wolken aus Feuer in meine Richtung.
Ich drehte mich um und griff einen Feuerlöscher, den ich zufällig am Wiesenrand fand. Zischend verschwanden die Flammen und der Drache schaute mich verdutzt an. Ich schaute neugierig zurück. Langsam ging ich auf ihn zu und zog an den Schuppen seines Halses seinen Kopf zu mir herunter.
""Wer bist Du?"" flüsterte ich ihm ins Ohr.
Er wurde auf einmal ganz klein, schrumpfte zusammen und wand sich wie ein sanftes Haustier um meine Knie.
""Ich bin Deine Angst."" sagte er leise.
Seine Augen füllten sich mit Tränen. Ich war erstaunt einerseits und hatte andererseits sofort Mitleid mit ihm. Große Tränen kullerten sein inzwischen kleines Gesicht hinunter. ""Was ist mit Dir?"" fragte ich.
""Ich möchte auch von Dir liebgehabt werden."" flüsterte er fast tonlos. Braune Augen sahen mich bittend an. Mein Herz atmete tief durch und öffnete sich weit.
Ich wachte auf. - - - - - - - - Was mir dieser Traum sagen wollte, ist inzwischen mein Lebensmotto : Wo die Angst ist, ist der Weg.... Denn die Angst ist ein wichtiges Gefühl, das uns etwas sagen möchte. Als Psychologin erlebe ich immer wieder, dass Menschen ihre Angst nicht mögen. Dabei hat sie spannende Antworten parat, wenn wir uns ehrlich fragen, wovor wir Angst haben. Du, liebe @ichbinsophiescholl hast Angst, dass Du Fritz verlieren könntest. Das heißt, er ist Dir sehr wichtig. Du möchtest ihm nicht schaden. Und Dich selbst dabei trotzdem nicht verraten. Und Dir ist bewusst, dass Krieg eine furchtbare, zerstörerische, unmenschliche Situation ist, in der sich niemand mehr sicher fühlen kann. Krieg bringt Menschen emotional und körperlich an ihre Grenzen und traumatisiert ganze Generationen. Und weil Dir das Dein Herz sagt, bist Du im Widerstand. Und das ist so mutig!!!!❤️",2021-07-17T20:53:48.000Z,13 likes,-,https://www.instagram.com/p/CRcOWPMsPD3/,comments2421875500100512488.csv
364,249-5,welt.bummlerin,@beerkulez der Führer hatte aber dunkele haare und braune augen,2021-05-11T15:52:55.000Z,0,249,https://www.instagram.com/p/COvMLLpn5pI/,comments-2041353748293571230.csv
238,200-5,mysoulonly,"@sannediezaubermaus so seh ich das auch, die Gegenseiten mussten ebenso leiden. Es gab genauso Gräueltaten auf allen Seiten. Ich könnte immer heulen, wenn ich Berichte lese, wie Menschenverachtend das Nazi-Regime war, Juden, Behinderte, anders Denkende wurde regelrecht vernichtet, Soldaten verheizt und dann gibt es wieder Erfahrungen, das es auf der anderen Seite leider auch oft nicht anders war.... Denke oft noch an eine verstorbene Patientin zurück, die aus Siebenbürgen stammte und in einem russischen Arbeitslager landete. Diese Frau musste sogar noch als ""alte"" Frau mehrmals am Unterleib operiert werden. Man mag sich gar nicht vorstellen, was sie, wie viele andere Frauen und junge Mädchen damals durchmachen und vor allem über sich ergehen lassen mussten. Im Krieg zeigt der Mensch oft seine böse Seite und dann gibt es Menschen, wie Sophie und ihre Freunde, die Lichtblicke in der Dunkelheit sind.",2021-08-23T10:56:47.000Z,12 likes,200,https://www.instagram.com/p/CS6MvKtD91X/,comments6008866202857888736.csv
16,17,vacaymodefox_ff,@ichbinsophiescholl Wir müssen versuchen unsere Probleme mit Worten zu lösen und jedem ein Ohr schenken damit sowas nie wieder passiert... Menschen die alleine im Dunkeln gelassen werden sind Knetteig für das Böse 😓,2021-05-19T16:14:28.000Z,0,-,https://www.instagram.com/p/CPBa7dTnZDz/,comments8984968377741028930.csv
193,194,phiwie82,"Ich darf dem gesamten Team von #ichbinsophiescholl zu diesem Projekt von ganzem Herzen gratulieren und danken. Ihr habt Geschichte erLEBbar gemacht. So muss Geschichtsaufarbeitung passieren, damit wir noch stärker sensibilisiert sind, damit sich solche schrecklichen Ereignisse nie mehr wiederholen. Wir müssen aus der Geschichte lernen um in der Gegenwart die richtigen Entscheidungen für die Zukunft zu treffen. Heute denke ich ganz besonders an Sophie und Hans Scholl und alle Beteiligten der weißen Rose. Ihr wart Leuchttürme in der dunkelsten Zeit 🖤",2022-02-22T15:08:32.000Z,0,-,https://www.instagram.com/p/CaR8yxIM3t8/,comments2405507495768764355.csv
28,29,ofoerderer,"Ich möchte Mut zusprechen, aber es fällt mir schwer😔Liebe Sophie, gesegnete Weihnachten und möge Gott die Dunkelheit besiegen🌠🙏🎄leider herrscht in vielen Menschen gerade heute Dunkelheit😥",2021-12-24T22:22:33.000Z,2 likes,-,https://www.instagram.com/p/CX374m8sG_-/,comments1946853339617092228.csv
388,246,the.little.things.i.see,"So grausam und böse der Mensch sein kann, so wundervoll und sorgend kann er auch sein. Ja, die Welt der Menschen ist zu oft unmenschlich. Und doch gibt es Hoffnung, Menschen die ihr Licht in all der Dunkelheit leuchten lassen. Anne Frank schrieb in ihr Tagebuch ""Trotz allem glaube ich an das Gute im Menschen"" Würde ich das nicht auch tun, würde ich wohl verzweifeln. (Das könnte jetzt etwas verwirrend sein)",2021-05-15T18:22:22.000Z,0,-,https://www.instagram.com/p/CO5yZnjnqE_/,comments1897514232024037253.csv
45,34,kuenstler_aussen,Irgendwie fehlen mir da Dunkelfarbige Personen. Ich empfinde das als eine nicht notwendige Unterrepräsentierung. Außerdem sollte in der Serie eine Frauenquote eingeführt werden,2021-06-15T07:34:32.000Z,2 likes,-,https://www.instagram.com/p/CQHMbLIs525/,comments2142916161249446921.csv
3,4,life_love_leni,"Auch heute noch superlecker, ich mags auch richtig schön dunkel (am liebsten noch ein Ei dazu) 😋",2021-07-14T18:00:33.000Z,1 like,-,https://www.instagram.com/p/CRQ9TIDqMdm/,comments4407109297727982151.csv
33,30,alex.t.amazona,Die müssen so dunkel sein! Dann schmeckt es erst richtig gut! 😉,2021-07-13T15:30:19.000Z,19 likes,-,https://www.instagram.com/p/CRQ9TIDqMdm/,comments4407109297727982151.csv
39,33,namaah81,"Da steckte viel Liebe drin, deswegen so dunkel. 😉",2021-07-13T14:53:26.000Z,1 like,-,https://www.instagram.com/p/CRQ9TIDqMdm/,comments4407109297727982151.csv
385,329,__goodgirrrl__,"Das Gute hat in Deiner Zeit gewonnen, liebe Sophie. Und das wird es auch immer tun. Das Licht ist einfach stärker als die Dunkelheit, und da wo Liebe und Hoffnung ist, ist auch das Licht! Wir werden kämpfen und siegen... immer und immer wieder - bis die Dunkelheit im Licht erstickt. ❤️🙌😘",2021-05-08T14:52:03.000Z,17 likes,-,https://www.instagram.com/p/COnXOjgHo4O/,comments-1380966327770057628.csv
138,92,krispieni,"Meine Oma is mit 14 nach Polen gefahren und hat sich Dauerwelle in die dunkeln Haare drehen lassen, statt brav Zöpfe zu flechten und zum BDM zu gehen. Rebell girls rock!",2021-06-02T13:25:11.000Z,1 like,-,https://www.instagram.com/p/CPnHGtfH9Um/,comments-6548082107139967429.csv
89,73,frau_pony_huetchen,Nach Dunkelheit kommt Dämmerung,2021-09-03T17:31:46.000Z,8 likes,-,https://www.instagram.com/p/CTXfON3METC/,comments8481689183351419748.csv
98,71,jolie.dharma,"Meine Oma war auch beim Bund Deutscher Mädel .... ja, so einiges an Liedern stimmt sie heute noch an....und sie erzählt auch noch von damals als sie befreundete jüdische Familien bei sich versteckt hielten. Nach Aussen den Schein der ""Zugehörigkeit"", aber auch die Menschlichkeit zu bewahren, war ein enormer Zwiespalt. Ihr Vater (mein Urgroßvater) an der Front in Frankreich als Dolmetscher stationiert, hat auch so einiges an Geschichten zu erzählen gehabt.... über die Unmenschlichkeit und über die Güte der Menschen. Wo Dunkelheit herrscht, da wird es auch immer Licht geben.",2021-05-16T17:00:27.000Z,1 like,-,https://www.instagram.com/p/CO7bXwbnI-F/,comments-6495335396302545305.csv
27,23,__lioba__7,"Das Wissen um die Geschichte unseres Landes verdunkelt vieles. Mit diesem Projekt ist es mir möglich, mitzudenken und mitzufühlen, wie das Leben damals war. Vielleicht hellt das die Vergangenheit etwas auf. Ich wünsche es mir sehr.",2021-06-13T19:42:33.000Z,4 likes,-,https://www.instagram.com/p/CQDwp0_IeCD/,comments-4725977479424954984.csv
421,202-8,mangarissi,@linus_smg_tf für Sophie als Mensch/Frau mit Kinderwünsch mag das Stimmen aber sie war und ist ein Zeichen der Hoffnung in Dunkeln Stunden für alle die nicht für auch selbst kämpfen können. #Manistnieallein,2021-09-24T10:30:47.000Z,2 likes,202,https://www.instagram.com/p/CUMmNHbD_eo/,comments2478608023503308228.csv
29,13-9,katharina.helling,"@finanightmare man kann/darf/soll Dinge kritisieren, und zwar immer und das geschieht auch jeden Tag an vielen Orten. Privat und öffentlich. In den Medien, bei Demonstrationen, in Debatten des Bundestages etc. Das Aufzeigen von „Parallelen“ zur nationalsozialistischen Diktatur ist aber problematisch/relativierend, wenn ein (vermeintlicher) Punkt aus diesem verbrecherischen, menschenverachtenden System herausgepickt wird und gesagt wird: „da, schaut’s her, das war damals auch so.“ und selbst dieser eine Punkt ist dann noch nicht mal „gleich“ wie damals. Zensur zB gab es auch zu Zeiten des deutschen Kaiserreichs (auch bei diesem Vergleich wird man zum Ergebnis kommen, dass das was heute passiert nicht so ist wie damals). Ebenso eine Impfpflicht (die es in Hinblick auf die Corona-Schutzimpfung nicht gibt).
Warum wird der Vergleich nicht zB zu dieser Zeit gezogen? Warum nimmt man das dunkelst Kapitel unserer Geschichte? Der Nationalsozialismus waren nicht ein paar Regeln, die problematisch waren/als problematisch empfunden wurden. Es war ein mordendes/unterdrückendes System, das das ganze Leben durchdrungen hat. Nicht ein Prof durfte etwas auf einer bestimmten Plattform nicht veröffentlichen und hat sich deswegen zurückgezogen, aber weiter seinen Lehrstuhl innegehabt und ein YouTubeVideo veröffentlicht.",2021-07-11T15:09:22.000Z,35 likes,13,https://www.instagram.com/p/CRJ_KIBs7Ix/,comments2105032599733204628.csv
25,18,anjamuller565,Wie gut wir es haben nicht in diesen dunkelsten Zeiten zu leben...ich bewundere Euch sehr wie ihr das schafft. Ihr seid so mutig und für alle ein Vorbild!!!❤️,2021-11-01T11:23:32.000Z,8 likes,-,https://www.instagram.com/p/CVuqOlMscrx/,comments679025243603117426.csv
77,47,juwelchen78,"Ich gehe viel in die Natur,in den Wald, da gibt es nur Liebe ❤ oder im Dunkeln die Sterne und den Mond betrachten.⭐🌝 und Mutter Natur Dankbar sein 🌳🐿🍀🦉🍁🦔🍃",2021-10-07T07:56:09.000Z,2 likes,-,https://www.instagram.com/p/CUt9_tqsiV-/,comments-8241152824148027062.csv
34,22-3,bhellerb,"Habe mal einen schönen Spruch auf einer (Kondolenz)Karte gelesen, der dieses Gefühl gut beschreibt: ""Man sieht die Sonne untergehen und erschrickt dennoch, wenn es dunkel wird."" Mich fröstelt schon ein wenig....",2021-09-27T21:25:48.000Z,5 likes,22,https://www.instagram.com/p/CUU4V6DsNNB/,comments-7823950054977062730.csv
27,28,katharina.helling,"🗓 13.02.1943

◼️ Griechenland

Den Juden wird die Benutzung von Telefonen und öffentlichen Verkehrsmitteln verboten. Nach Einbruch der Dunkelheit ist ihnen das Betreten der Straßen untersagt. Bei unerlaubtem Verlassen ihres ständigen Wohnsitzes droht ihnen sofortige Erschießung.

◼️ Frankreich/Auschwitz

Mit einem Transport aus dem Lager Drancy kommen 998 jüdische Menschen in Auschwitz an. 143 Männer und 53 Frauen werden in das Lager eingewiesen; 802 Menschen werden in den Gaskammern getötet. (Czech, S. 414)

◼️ Nordafrika

Die jüdische Gemeinde in Djerba, Tunesien, wird von den deutschen Besatzungsbehörden zur Zahlung von 10 Millionen Francs gezwungen.

◼️ Bulgarien

Das Auswärtige Amt an die deutsche Gesandtschaft in Sofia.

Dem bulgarischen Ministerpräsidenten soll mitgeteilt werden, daß man dringend abrate, auf den britischen Vorschlag zur Auswanderung jüdischer Kinder nach Palästina (s. 4.2.43) einzugehen. Es sei sonst zu befürchten, daß die Kinder ""zu 5.000 Propagandisten gegen unsere antisemitischen Maßnahmen erzogen würden"".
Ein Entgegenkommen würde von den Gegnern als Schwächezeichen ausgelegt und propagandistisch verwertet werden. ""Auch vertrüge sich eine derartige Maßnahme nicht mit unserer Politik gegenüber den arabischen Völkern."" (ADAP, Serie E, Bd. V, Nr. 98, Fußnote)
〰️
http://www.holocaust-chronologie.de/chronologie/1943/februar.html",2022-02-13T19:32:33.000Z,3 likes,-,https://www.instagram.com/p/CZ61Av2sW0M/,comments-5333217302560759961.csv
35,36,_frolleinschnabelstedt_,"Ich feier alleine, spazieren gehen, wenn es bald dunkel wird und all die Lichter bestaunen. Dann durchgefroren aber glücklich gehts heim, Essen (Fondue) vorbereiten, wenn es richtig dunkel ist höre ich die klassischen Weihnachtslieder, denke an meine Lieben….dann packe ich die Geschenke aus, alternativ esse ich zuerst, dann die 🎁 Geschenke…. später wird ein Weihnachtsfilm geschaut…",2021-12-23T19:44:44.000Z,6 likes,-,https://www.instagram.com/p/CX1UDwnMWc6/,comments6919415458388675497.csv
132,58-37,heikegumz,"@riso5400 Die Szene war bei einem späteren Besuch von Elisabeth bei ihren Geschwistern in München, Anfang Februar 1943. Bei einem Spaziergang gemeinsam mit Sophie durch den Englischen Garten entwickelte sich - nach Elisabeths Erinnerungen - dieser Dialog: ""Meine Schwester sagte:' Jetzt in dieser Dunkelheit, müsste man Freiheitsparolen auf Mauern schreiben.' Ich erwiderte: 'Ich habe noch einen Bleistift in der Tasche.' Sophie lachte und klärte mich auf, dass man das mit einem Bleistift nicht machen könne, dazu brauche man Teerfarbe. Als ich ihr zu verstehen gab, dass das doch sehr gefährlich sei, antwortete sie: 'Die Nacht ist des Freien Freund.' "" (Beuys, 2010, S. 426).

Zur selben Zeit waren Hans Scholl und Alexander Schmorell tatsächlich in München unterwegs und haben mit Teerfarbe ""Nieder mit Hitler"" an Hauswände gemalt. Elisabeth hat aber weder davon noch von der parallel stattfindenden Arbeit an den Flugblättern etwas mitbekommen.",2021-11-08T17:00:31.000Z,9 likes,58,https://www.instagram.com/p/CWAyg1ZMVCw/,comments8027454365758008790.csv
72,73,katharina.helling,"Am 24. Februar wurde in der Lokalpresse auch ein Fahndungsaufruf mit Foto veröffentlicht , hier beispielhaft aus dem Amper-Boten (Dachauer Tageszeitung):
„*1000 Reichsmark Belohnung für die Mitwirkung zur Ergreifung eines Verbrechers*

Die Staatliche Kriminalpolizei, Kriminalpolizeistelle München, gibt folgendes bekannt:
Alexander Schmorell , geboren am 16. (3.)
September 1917, Orenburg [Russland], zuletzt in München wohnhaft gewesen. Schmorell ist 1,82 bis 1,85 m groß, schlank, hat dunkelblonde Haare, blau-graue Augen, große, abstehende Ohren, etwas vorstehenden Kehlkopf, aufrechte Gangart und spricht hochdeutsch mit bayerischem Einschlag. Er trug zuletzt graugrünen Sporthut mit weißgrauer Kordel, grauen, schwarz-weiß-gesprenkelten Wintermantel mit Rückenspanne, graue Joppe, lange, hellgraue Hose und braune abgetragene Halbschuhe.
Die Bevölkerung wird zu Mitfahndung unter Hinweis auf die ausgelobte Belohnung, dir nur für Privatpersonen bestimmt ist, aufgefordert. Sachdienliche Mitteilungen, die auf Wunsch vertraulich behandelt werden, werden an die Kriminalpolizeidienststelle München, 16. Komm, Zimmer 385, Nebenstell 457, oder an die nächste Polizeidienststelle erbeten.“",2022-02-24T22:40:44.000Z,58 likes,-,https://www.instagram.com/p/CaYHSFfs401/,comments9192783458000178765.csv
6,7,stefann34,"Wie kann man nur so schön sein und so stark lieben als wäre in der Welt nur das Gute zu Hause und jeder Stern möge dir den Weg der Hoffnung durch Dunkelheit hindurch ins Licht leuchten. 🌹Wer mit dem Herzen sieht hat Flügel der Liebe, die diese Erde mit sanfter Güte überziehen und zu einem besseren Morgen machen!",2021-06-27T16:09:51.000Z,5 likes,-,https://www.instagram.com/p/CQni4dmqGB_/,comments-1578856188055300057.csv
33,34,kleinemelli23,Am 6.11.1942 verschwand der Vater meines Opas spurlos an der nördlichen Abriegelungsfront von Stalingrad. Laut Feldpost war die Nacht dunkel und regnerisch und er könnte sich auf dem Weg zum Küchenwagen verirrt haben.,2022-01-31T14:39:34.000Z,1 like,-,https://www.instagram.com/p/CZY-uLdsyWR/,comments-6464971102781378600.csv
8,9,gwen_gloeckchen,"Liebe Sophie. Ein Lieblingsweihnachtslied habe ich nicht. Aber ,,Es wird schon gleich dunkel...'' mag ich sehr. Liebe Grüße und gesegnete Weihnachten 🎄",2021-12-25T14:01:25.000Z,0,-,https://www.instagram.com/p/CX3no6KlpbI/,comments-7678315294654487670.csv
60,26,melanie_memi,"Mein uropa war wegen dem statz: ""Dummer hitler"" 6 Wochen in Dunkelhaft und wurde dann an die vorderste Front geschickt und hat als einziger überlebt in seiner Einheit.",2021-08-07T22:46:46.000Z,7 likes,-,https://www.instagram.com/p/CSR50AbMAvF/,comments5511446747071241701.csv
28,17-3,gull.weig,"@lieschen_mueller Mir liegt dunkel in Erinnerung, dass Heinz Rüc",2021-11-06T23:47:14.000Z,0,17,https://www.instagram.com/p/CV8WBxSsKFb/,comments-1238817253976130177.csv
52,53,heikeirene_m,"Ein Glück gab es diesen kleinen Kreis von Widerstand, auch noch zu erwähnen der Kreis um Stauffenberg. Sie dachten wahrscheinlich damals, es war alles umsonst und sie haben nichts bewirkt. Wenn sie wüssten, dass sie geschichtlich sowas von wichtig gewesen sind und ihr Tod nicht umsonst war, sondern dass es eben zeigten, dass unter den vielen Tätern und Mitläufern eben auch diese kleine Gruppe Mutiger existierte, dafür müssen wir so dankbar sein. Nicht ganz Deutschland war dunkel in dieser Zeit, sondern es gab auch das kleine Licht.",2022-02-26T19:11:54.000Z,1 like,-,https://www.instagram.com/p/CacDSc4s5ts/,comments2932642153076203407.csv
60,45,ava.santimea,"ich verstehe es... ich wünsche mir auch so ein Zeichen. manchmal muss man nur wachen Blickes durchs Leben gehen und sieht hunderte gute Zeichen, und andere Tage sind ganz dunkel und einsam... manchmal fällt es mir schwer, einfach zu vertrauen. und zu glauben! doch ich darf den Glauben nicht verlieren, wo ich ihn gerade erst gefunden habe...",2021-07-28T18:59:27.000Z,7 likes,-,https://www.instagram.com/p/CR4Ob3vK6Nt/,comments-3557176044160817635.csv
