,Id/Reply-Id,User,Comment,Date,Likes,Reply To CommentId,Link,Filename
25,15-4,o.dani.g.o,"@heikegumz Ich kann Ihren Ansatz und die Beweggründe nachvollziehen. Da muss ich wirklich meinen Respekt aussprechen, dass es Ihnen trotz der Umstände gelingt, sachlich zu bleiben. Ich habe leider keinen persönlichen Bezug oder besser gesagt, Verbindung zu den Nachfahren der Familie Scholl. Ich wollte einfach nicht, dass es auch auf diesem Kanal so eskaliert wie in vielen anderen Bereichen dieser Plattform. Der Grund weshalb ich meinen reframing-Beitrag machte, war, dass ich es noch von meiner Urgroßtante (geb. 1920) beigebracht bekam, in schlechten Zeiten etwas negatives positiv zu umschreiben, damit es zumindest in der Seele nicht ganz dunkel wird. Es war nicht meine Absicht, Inge Scholl etwas anzudichten. Mir persönlich wird in den letzten Beiträgen zu sehr auf Inge herum gehackt. Als würde man versuchen, gezielt etwas zu zerstören. Ich dachte, naiv wie ich bin, etwas positives oben in den Nachrichten, würde etwas Dampf vom Kessel nehmen. Ein negativer Ansatz steckte nicht dahinter.",2021-08-27T12:41:50.000Z,7 likes,15,https://www.instagram.com/p/CTEPwCDsSq7/,comments-2884588778184493971.csv
24,25,marcus_haub,"Und heute: Ich verdunkele nicht. Ist überhaupt nicht erwiesen, dass das was bringt. Und überhaupt weiß man noch nichts über die Langzeitfolgen der Verdunkelung. Und diese angeblichen Bomben sind doch auch nicht schlimmer als Hagel.",2022-01-07T07:05:01.000Z,1 like,-,https://www.instagram.com/p/CYZkVnOM-3t/,comments7329169556701907357.csv
76,77,ichbinsophiescholl,"#TeamSoffer Der Luftschutz wurde mit Beginn des Zweiten Weltkrieges verschärft. Die Bevölkerung war zu Verdunkelungsmaßnahmen angehalten. Verdunkelung sollte die Sicht auf potenzielle Angriffsziele verhindern, half aber weniger gegen Flächenbombardierungen.",2022-01-06T18:58:03.000Z,230 likes,-,https://www.instagram.com/p/CYZkVnOM-3t/,comments7329169556701907357.csv
70,71,changed.by.popular.demand,"„Die Wehrmachtsbordelle, auch „Seuchenschutzeinrichtungen“ genannt, wurden während des Zweiten Weltkrieges systematisch zum Zwecke der Soldatenbefriedigung und Unterbin- dung von Homosexualität sowie zur Vermeidung von Geschlechtskrankheiten ausgehend vom besetzten Frankreich im Jahr 1940 vom Oberkommando der Wehrmacht in allen Besatzungs- zonen installiert. Verschiedene Quellen deuten einerseits auf zwangshafte und gewaltvolle Rekrutierung hin und andererseits auf eine gewaltfreie Vermittlung von vormals freien Prostituierten, welche sich aufgrund von Existenznöten zur Bordellarbeit entschlossen. Obwohl die genaue Anzahl der Frauen, welche in den einzelnen Wehrmachtsbordellen innerhalb der gesamten Besatzungszonen den deutschen Soldaten zur Verfügung zu stehen hatten, im Dunkeln liegt, wurde in einem internen Bericht der deutschen Reichsregierung aus dem Jahr 1943 von 1116 Frauen in 143 staatlich organisierten Einrichtungen alleine im Militärverwaltungsbezirk A (Nordwestfrankreich) ausgegangen.“

https://unipub.uni-graz.at/obvugrhs/content/titleinfo/760009/full.pdf",2022-01-25T16:58:16.000Z,62 likes,-,https://www.instagram.com/p/CZKRQmbssJ4/,comments-1093181261621933110.csv
30,20,k_in_der_aussicht,"Vom Fallen habe ich auch schon oft geträumt. Ich glaube allerdings nicht, dass es etwas mit dem erwachsen sein zu tun hat. In meiner Erinnerung bin ich schon als Kind im Traum erschrocken, weil ich meinte zu fallen. Wichtig ist, dass wir das Kind in uns bewahren für die kleinen kostbaren Momente, die uns immer wieder begegnen, dann können wir auch heitere Träume haben, egal wie dunkel es um uns herum gerade ist. Sei lieb gegrüßt und träum was Schönes ♥️",2021-08-16T21:31:11.000Z,6 likes,-,https://www.instagram.com/p/CSpk_pDs2op/,comments2492601519145453659.csv
117,62-9,kreativ435,"@boncomic Ein maßgeblichen Teil des Lebens in Frage zu stellen, ist sicher immer schwer. Ich bin 1956 geboren, also 11 Jahre nach Kriegsende. Erst in den 1968 bekam ich Antworten, die ich eigentlich von meinen Eltern hätte bekommen sollen. Meine Informationen wurden mühsam zusammengetragen. Unter anderem durch das Buch von Anne Frank. Immer blieben die Fragen offen :Wie weit waren die Eltern involviert. Ein Misstrauen, dass mein ganzes Leben blieb. Ich wollte nicht werten, aber ich hätte gerne eine Auseinandersetzung mit dem Thema gehabt. Statt dessen SCHWEIGEN und nie ein Wort des Bedauerns. Gut zu wissen, dass es heute viele junge Leute gibt, die immer noch versuchen, Licht ins Dunkel zu bringen. Vielleicht hilft es tatsächlich neue und alte Nazis zum Nachdenken zu bringen. Liebe Grüße",2021-06-01T08:41:46.000Z,1 like,62,https://www.instagram.com/p/CPidUXZKcq3/,comments8963211296755535549.csv
8,9,katharina.helling,".
🗓 13.02.1943

◼️ Griechenland

Den Juden wird die Benutzung von Telefonen und öffentlichen Verkehrsmitteln verboten. Nach Einbruch der Dunkelheit ist ihnen das Betreten der Straßen untersagt. Bei unerlaubtem Verlassen ihres ständigen Wohnsitzes droht ihnen sofortige Erschießung.

◼️ Frankreich/Auschwitz

Mit einem Transport aus dem Lager Drancy kommen 998 jüdische Menschen in Auschwitz an. 143 Männer und 53 Frauen werden in das Lager eingewiesen; 802 Menschen werden in den Gaskammern getötet. (Czech, S. 414)

◼️ Nordafrika

Die jüdische Gemeinde in Djerba, Tunesien, wird von den deutschen Besatzungsbehörden zur Zahlung von 10 Millionen Francs gezwungen.

◼️ Bulgarien

Das Auswärtige Amt an die deutsche Gesandtschaft in Sofia.

Dem bulgarischen Ministerpräsidenten soll mitgeteilt werden, daß man dringend abrate, auf den britischen Vorschlag zur Auswanderung jüdischer Kinder nach Palästina (s. 4.2.43) einzugehen. Es sei sonst zu befürchten, daß die Kinder ""zu 5.000 Propagandisten gegen unsere antisemitischen Maßnahmen erzogen würden"".
Ein Entgegenkommen würde von den Gegnern als Schwächezeichen ausgelegt und propagandistisch verwertet werden. ""Auch vertrüge sich eine derartige Maßnahme nicht mit unserer Politik gegenüber den arabischen Völkern."" (ADAP, Serie E, Bd. V, Nr. 98, Fußnote)
〰️
http://www.holocaust-chronologie.de/chronologie/1943/februar.html",2022-02-13T18:51:37.000Z,5 likes,-,https://www.instagram.com/p/CZ7GST4Nmza/,comments-5780711276281222222.csv
152,93-3,k_in_der_aussicht,"@erdbeerglueck Nun, ich glaube da gab es noch nicht einmal Schatten. Dieses Vernichtungssystem kann sich in unserer Generation, auch nach mehrmaligem Besuch eines Lagers, wohl kaum jemand vorstellen- nur Dunkelheit ohne einen Funken Licht oder Hoffnung. Wir sollten wirklich gegen alles Vergessen aufstehen. Heute gibt's allerdings viel Desinteresse und Unwissenheit, in jeder Altersklasse und sozialer Ebene. Genau deshalb finde ich diese Plattform so gut. Sie soll alle Schichten und jedes Alter erreichen. Wir haben hier ja gerade dieses Mädel kennen gelernt. Sie lässt uns teilhaben an ihren Gedanken. Ich glaube, dass sich die Stimmung in der kommenden Zeit noch sehr verändern wird. Augenblicklich wird sie ja noch von ihrem Bruder, aus Vorsicht, rausgehalten. Es kann ja jeder für sich entscheiden was er von diesem Projekt halten mag. Ich kenne die Geschichte und weiß auch um die harte Realität der ""weißen Rose"". Aber hier geht's um nicht mehr und nicht weniger als um ein junges Mädchen mit Idealen und die fatale Entwicklung, deren Ende wir alle kennen sollten.",2021-05-23T18:45:37.000Z,5 likes,93,https://www.instagram.com/p/CPODxD9Hr1J/,comments8277147873245069619.csv
27,20,floh312,Die Augen im Dunkeln auflassen und wenn man noch so müde ist.,2021-08-16T14:26:32.000Z,0,-,https://www.instagram.com/p/CSoA5zBMF-L/,comments3537679706792646601.csv
