Link: ;https://www.instagram.com/p/CRWz2JZMx0i/
Id/Reply-Id;User;Comment;Date;Likes;Reply To CommentId
1;_benitabb;@paul.kkl;2021-07-17T11:16:19.000Z;0;-
2;akhlaghi0015;❤️Nice;2021-07-17T11:04:38.000Z;0;-
3;moo_myung;"Liebe Sophie, übel nimmt er dir es sicher nicht. Du kannst ja kaum was dafür. Aber nach so einer schlimmen Nachricht … wer weiß wie man da reagieren sollte? Groß Lust mich zu unterhalten hätte ich wohl auch nicht.
😢";2021-07-16T09:37:40.000Z;3 likes;-
3-1;ichbinsophiescholl;@moo_myung Das stimmt wohl. Ich verstehe ihn da schon!;2021-07-16T10:01:10.000Z;13 likes;3
4;tina_eckert_;Danke für dieses Projekt!man bekommt Geschichte,lebendig näher gebrachta;2021-07-16T08:50:09.000Z;0;-
5;sui_los_gatos;War dass eigentlich früher so üblich, dass die Medizinstudenten zum Sanitätsdienst in den Semesterferien eingezogen wurden? Wie gefährlich war das? Und warum wurden Hans und Alex eigentlich nicht regulär eingezogen?;2021-07-16T08:12:32.000Z;3 likes;-
5-1;ichbinsophiescholl;@sui_los_gatos #TeamSoffer Als Studierende mussten sie während des Semesters erst einmal nicht an die Front. Neben Hans und Alex wurden auch noch weitere Medizinstudenten als 2. Studentenkompanie einberufen, um ihren Militärsdienst an der Ostfront abzuleisten. Sie wurden jedoch nicht aktiv als Soldaten eingesetzt, sondern dienten der medizinischen Versorgung von Soldaten und leisteten damit ihre Vorraussetzung für das Studium geltende Feldfamulatur ab.;2021-07-16T10:43:44.000Z;12 likes;5
5-2;sui_los_gatos;@ichbinsophiescholl also war ihnen in Prinzip klar, dass der Moment irgendwann kommen würde, wenn es Voraussetzung für das Studium war;2021-07-16T12:13:52.000Z;1 like;5
5-3;adri.s.autorin;@ichbinsophiescholl du meinst als Studenten...? 😅;2021-07-16T16:21:10.000Z;0;5
6;ida.k_04;Warum wird eigentlich nicht thematisiert, dass Hans auch männliche Liebhaber hatte? Schließlich wurde er ja leider auch dafür verhaftet.;2021-07-16T06:03:38.000Z;7 likes;-
6-1;ichbinsophiescholl;@ida.k_04 #teamsoffer wurde es ziemlich am Anfang des Projektes schon einmal und wir geben diesen Kontext immer wieder als Redaktion in den Kommentaren.;2021-07-16T08:09:26.000Z;16 likes;6
7;mary2ana;ich glaube nicht dass die flugblätter wirklich das sind was wirklich zählte...;2021-07-16T01:14:46.000Z;0;-
8;jana.makes.things;man weiß, was passieren wird, aber ich habe mich so an Sophie und die anderen gewöhnt, dass ich jetzt schon Angst vor dem Tag habe, an dem es still wird auf diesem Kanal...;2021-07-15T21:44:12.000Z;17 likes;-
9;darth_vato58;Sophie 😍;2021-07-15T21:37:38.000Z;1 like;-
10;sebastianaugustin24;Gibt es hier die Flugblätter im Wortlaut zum nachlesen?;2021-07-15T20:30:30.000Z;5 likes;-
11;emeliedorr;wahrscheinlich überlegt er was et tun soll…;2021-07-15T20:29:57.000Z;1 like;-
12;_yoga_tanz;Sehr unterschiedliche Bewältigungsstrategien bei den Menschen. Manche können Fakten hervorragend verdrängen. Damals wie heute.;2021-07-15T20:05:40.000Z;1 like;-
13;benjamin.stefan.l;"Und wir fürchten den Brief über die Unizulassung unseres Sohnes. Wie belanglos das doch ist und wie gut es uns doch geht.
Das sollte sich jeder heute immer wieder vor Augen führen.
Danke dafür!!!";2021-07-15T19:59:04.000Z;11 likes;-
14;sara_fina_yo;Oh, ist das nicht sophie mit alex auf dem bild und nicht Hans? 🤭 Haben die Schauspieler eig auch Instagram?;2021-07-15T19:42:37.000Z;3 likes;-
14-1;ichbinsophiescholl;"@sofia_lukas_official #teamsoffer Hans hat das Foto geschossen.
Und ja, haben sie. Auf diesem Bild sind David Hugo Schmitz als Alexander Schmorell und Luna Wedler als Sophie Scholl zu sehen. :)";2021-07-15T19:53:08.000Z;19 likes;14
14-2;sara_fina_yo;@ichbinsophiescholl achsooo haha ups 😂 danke für die Antwort! Voll cool;2021-07-15T19:59:36.000Z;0;14
14-3;david_hugo;@sofia_lukas_official / SophieScholl wird gespielt von @lunawedler & AlexanderSchmorell von @david_hugo :);2021-07-15T20:33:39.000Z;11 likes;14
15;giusy79_;Hallo liebe Sophie, ich denke das Hans in einem Gedankenkarussell ist, und einfach nicht zur Ruhe kommt.  Such nicht die Schuld bei dir! 🙌❤️;2021-07-15T19:27:14.000Z;3 likes;-
16;yuri_b.lay;❤️❤️;2021-07-15T19:12:41.000Z;2 likes;-
17;sofia.ostrea;"Gerade bin ich an der Stelle, nach Versendung des 4. Flugblattes, im Buch ""Wir schweigen nicht"" ...ich habe das Buch vor Jahren von meinen Großeltern geschenkt bekommen.. und als ich vor kurzem dein Instagramprofil (euer tolles Instagram Projekt) entdeckt habe ,hab ich große Lust bekommen das Buch zu lesen, endlich ☺️😅";2021-07-15T19:04:11.000Z;6 likes;-
18;weingummijunkie;Liebe Sophie, Hans wird Angst haben was auf ihn zukommen wird an der Ostfront. Und diesen Konflikt und seine Arbeit im Widerstand gerade innerlich verarbeiten. Sei für für ihn da. Haltet zusammen, die Sonne wird wieder scheinen !;2021-07-15T18:40:52.000Z;7 likes;-
19;gwen_gloeckchen;Liebe Sophie. Bitte mach Dir keine Vorwürfe. Ihr seid alle wunderbar und auch wenn im Augenblick gar nichts mehr nach Plan zu laufen scheint, bitte hört nicht auf! Glaubt an euch, so wie ich an euch glaube... Ich bin in Gedanken bei euch!! ❤️❤️❤️❤️❤️;2021-07-15T18:39:53.000Z;3 likes;-
20;matthilauf;Liebe Sophie, wurde denn Alex auch eingezogen?;2021-07-15T18:27:57.000Z;17 likes;-
20-1;ichbinsophiescholl;@matthilauf Alex hat den selben Brief bekommen wie Hans und muss ebenfalls zum Sanitätsdienst an die Ostfront...;2021-07-15T18:30:09.000Z;38 likes;20
21;katrinpruchniewski;Vielleicht macht sich Hans auch sehr viel Gedanken über den Krieg.;2021-07-15T18:26:30.000Z;1 like;-
22;sunshinesun.666;Habt ihr die ersten drei Flugblätter denn schon verteilt und wenn ja wie? Oder sammelt ihr die gerade noch?;2021-07-15T18:26:13.000Z;3 likes;-
22-1;ichbinsophiescholl;@sunshinesun1239 Die haben wir an Schriftsteller, Professoren und Buchhändler aus München und Umgebung verschickt. Aber auch an der Uni und an Freunde haben wir welche verteilt.;2021-07-15T18:34:05.000Z;21 likes;22
22-2;tam1805;@ichbinsophiescholl diese Flugblätter zu verschicken ist aber gefährlich, oder?;2021-07-16T11:08:28.000Z;0;22
22-3;ichbinsophiescholl;@tam1805 Ja, wir dürfen uns nicht dabei erwischen lassen!;2021-07-16T11:22:06.000Z;0;22
22-4;kajazm;@sunshinesun1239 so weise Worte;2021-07-19T12:45:58.000Z;0;22
23;fanni_diamondwave;Was ist eigentlich mit Christoph? Der arbeitet doch auch an den Texten der Flugblätter mit 🤔;2021-07-15T18:23:19.000Z;2 likes;-
24;tabeathielmann;Was läuft da zwischen Irma & Hans? Was ist mit Traute passiert???😢;2021-07-15T18:20:57.000Z;16 likes;-
24-1;gwen_gloeckchen;@tabeathielmann Das frag ich mich leider auch...😢;2021-07-15T18:36:45.000Z;2 likes;24
24-2;ichbinsophiescholl;@tabeathielmann Die zwei haben gestern scheinbar zusammen am See gezeltet. Ich bin auch geschockt...;2021-07-15T20:04:57.000Z;4 likes;24
24-3;taschachan;"@tabeathielmann Aber ich frage mich, wir sie auf diese Geschichte mit Hans und Irma kommen, zumal ja Irma eine fiktive Person ist... Also ob da was Ähnliches im Original ""vorgefallen"" ist oder ob das frei erfunden ist (und mit welchem Hintergrund)...";2021-07-15T20:08:31.000Z;3 likes;24
24-4;tabeathielmann;Gute Frage!!! @taschachan @ichbinsophiescholl;2021-07-15T20:10:03.000Z;3 likes;24
24-5;ichbinsophiescholl;@taschachan #teamsoffer Irma ist zwar eine fiktive Figur, dass Hans jedoch oft Liebeleien mit Freundinnen von Sophie hatte (beispielsweise Lisa Remppis), ist historisch belegt.;2021-07-15T20:21:41.000Z;102 likes;24
24-6;taschachan;@ichbinsophiescholl Danke für eure Antwort! Das passt ja zu meiner These Nummer 1. Schön, dass ihr nah an der Realität bleibt!;2021-07-15T20:22:55.000Z;3 likes;24
24-7;felicitas.hecker;"@tabeathielmann Ich glaube, Hans war in der Beziehung recht ""lebenslustig"". Persönlich finde ich es nicht schlecht, dass es so war: Die WiderstandskämpferInnen waren ganz normale Menschen, Helden wurden sie erst. ..";2021-07-15T21:00:28.000Z;11 likes;24
25;sabine_daniela_ww;Ich bewundere dich und dein Engagement!🤍;2021-07-15T18:13:29.000Z;9 likes;-
26;utabaumann68;Ihr seid großartig ❤️;2021-07-15T18:04:59.000Z;11 likes;-
27;red_winona;Kannst du doch nichts für. Ich glaub, Hans Nerven sind grad nur ein bischen strapaziert. Umso wichtiger, dass ihr fokussiert und vor allem vorsichtig seid und bleibt...;2021-07-15T18:03:14.000Z;22 likes;-
27-1;ichbinsophiescholl;@red_winona Bei Alex hat die Konzentration auf die Flugblätter auf jeden Fall geholfen, sich abzulenken. Ich hatte gehofft, Hans ergeht es genauso, aber er war die ganze Nacht sehr abwesend...;2021-07-15T18:17:49.000Z;21 likes;27
27-2;red_winona;@ichbinsophiescholl mach dir man keine Gedanken. Bist halt eine fürsorgliche Schwester und willst natürlich alles in trockenen Tüchern wissen. Hans fängt sich wieder. Ganz gewiss....;2021-07-15T20:40:49.000Z;3 likes;27
28;alyeskaleto;Was passiert eigentlich wenn man sich weigert an die Ostfront zu gehen? Kann man das nicht irgendwie umgehen? Oder wird man dann knallhart erschossen oder irgendwo anders hinkutschiert?;2021-07-15T17:57:16.000Z;6 likes;-
28-1;nilsbraun_;@alyeskaleto Wehrkraftzersetzung: – in der Regel Einweisung in ein KZ – und bei Festhalten ihrer Verweigerung die Todesstrafe;2021-07-15T18:32:16.000Z;7 likes;28
28-2;ichbinsophiescholl;@nilsbraun_ #teamsoffer Genau! Der Strafbestand der „Wehrkraftzersetzung“ wurde 1938 mit der sogenannten Kriegssonderstrafrechtsverordnung von den Nationalsozialisten geschaffen und wer schuldig gesprochen wurde, dem drohte die Hinrichtung.;2021-07-15T18:41:45.000Z;14 likes;28
29;ava.santimea;ps, #TeamSoffer, rauchen die Schauspieler eigentlich auch? oder musstet ihr das für das Projekt irgendwie inszenieren?;2021-07-15T17:54:55.000Z;6 likes;-
30;ava.santimea;Ich denke, hättest du anders gehandelt, hätte Hans sich gewünscht früher informiert zu werden. du hast das richtige gemacht!;2021-07-15T17:53:51.000Z;4 likes;-
31;hauptstadtlady50;Ich hoffe sehr es gibt eine Lösung liebe Sophie.;2021-07-15T17:51:28.000Z;5 likes;-
32;lyrikerin_dieseelenmuse;Das Foto ist sehr schön und auf gewisse Weise sehr intensiv getroffen.;2021-07-15T17:45:17.000Z;12 likes;-
33;can_d79;Oft wird der*die Botschafter*in verurteilt, statt die Botschaft;2021-07-15T17:41:53.000Z;15 likes;-
34;mehmed.koenig;"Liebe Sophie,
hör auf die Schuld bei Dir zu suchen. Du hast damit absolut nichts zu tun. Es ist wohl eher die Botschaft gewesen, die Hans so durcheinander und wohl auch so nachdenklich macht.
Haltet zusammen, seid mutig, seid stark! ❤️";2021-07-15T17:41:31.000Z;133 likes;-
34-1;ichbinsophiescholl;@mehmed.koenig Da hast du wahrscheinlich recht... Danke für deinen Zuspruch! 🌺;2021-07-15T17:44:27.000Z;49 likes;34
34-2;mehmed.koenig;@ichbinsophiescholl Nicht dafür! Immer, liebe Sophie! Immer! ❤️;2021-07-15T17:45:11.000Z;2 likes;34
34-3;frauklausberta;@mehmed.koenig;2021-07-16T07:21:08.000Z;0;34
35;anjam409;Warum ist eigentlich Sophie Scholl so viel bekannter als Hans Scholl? Hat sie vielleicht mehr Aufzeichnungen hinterlassen oder so?;2021-07-15T17:41:12.000Z;26 likes;-
35-1;viiolencia;"@anjam409 ich denke das liegt daran dass Sophie Tagebücher geschrieben hat. Dann kann man das schlecht aus Hans seiner Ansicht ""verfilmen""";2021-07-15T17:45:40.000Z;16 likes;35
35-2;ichbinsophiescholl;@anjam409 #teamsoffer Sophie hat Im Gegensatz zu Hans Tagebuch geführt. Aufzeichnungen von Briefen und Verhörprotokolle gibt es über beide Geschwister, hier geben die Briefwechsel von Sophie und ihrem Freund Fritz Hartnagel aber teils mehr Aufschluss, als beispielsweise die Briefe der beiden an die Eltern. Des Weiteren wurde Sophie Scholl bisher filmisch und künstlerisch viel intensiver verarbeitet - wahrscheinlich weil sie zum Zeitpunkt ihrer Hinrichtung noch so jung und eine Frau in einer Widerstandsbewegung war.;2021-07-15T18:13:58.000Z;92 likes;35
35-3;heikegumz;"@anjam409 Ein weiterer Grund vielleicht: Hans war homo- oder bisexuell, d.h. der §175a, für den er 1937 angeklagt wurde, galt in der BRD unverändert bis 1969 und hinsichtlich der Vorwürfe gegen Hans, weil es sich um homosexuelle Handlungen von männlichen Personen unter 18 handelte, sogar bis 1994.
Die Schwester Inge, die sich sehr um das Andenken an die beiden gekümmert hat, hat immer versucht, die Homo- oder Bisexualität von Hans zu verheimlichen - was eine nähere Auseinandersetzung mit ihm schwerer machte. Außerdem hätte er mit diesem Wissen sicherlich auch über viele Jahrzehnte in weiten Teilen der Bevölkerung keine ungeteilte Anerkennung mehr erfahren.";2021-07-16T11:25:14.000Z;6 likes;35
35-4;anjam409;@heikegumz wow krass, danke für die Informative Antwort!;2021-07-16T15:54:17.000Z;0;35
36;selmamueller;Was genau macht ihr eigentlich momentan, feilt ihr an den Texten oder vervielfältigt ihr Flugblätter? Und bei welchem Flugblatt seid ihr gerade?;2021-07-15T17:39:34.000Z;19 likes;-
36-1;ichbinsophiescholl;@selmamueller Wir sitzen gerade am vierten Flugblatt und sind fleißig am vervielfältigten. Haben die ganze Nacht geschuftet und einiges geschafft!;2021-07-15T17:54:42.000Z;46 likes;36
